{
  "schemaVersion": "0.1.0",
  "manifestVersion": "0.1.0",
  "packVersion": "0.1.0",
  "id": "pack:synthetic:demo",
  "releaseId": "release:synthetic:demo-v1",
  "synthetic": true,
  "title": "SYNTHETIC: demonstration pack, not real ballot data",
  "scope": {
    "jurisdictionId": "jurisdiction:synthetic:demo",
    "electionId": "election:synthetic:2099-11-03"
  },
  "dependencies": [],
  "reviewStatus": "synthetic",
  "validation": {
    "status": "passed",
    "validatorVersion": "0.1.0"
  },
  "elections": [
    {
      "id": "election:synthetic:2099-11-03",
      "jurisdictionId": "jurisdiction:synthetic:demo",
      "date": "2099-11-03",
      "title": "SYNTHETIC demonstration election"
    }
  ],
  "measures": [
    {
      "id": "measure:synthetic:demo-a",
      "label": "DEMO A",
      "title": "SYNTHETIC one-year program",
      "scope": {
        "jurisdictionId": "jurisdiction:synthetic:demo",
        "electionId": "election:synthetic:2099-11-03"
      },
      "coverage": "reviewed"
    },
    {
      "id": "measure:synthetic:demo-b",
      "label": "DEMO B",
      "title": "SYNTHETIC pending analysis",
      "scope": {
        "jurisdictionId": "jurisdiction:synthetic:demo",
        "electionId": "election:synthetic:2099-11-03"
      },
      "coverage": "pending"
    }
  ],
  "sources": [
    {
      "id": "source_revision:synthetic:text-v1",
      "sourceId": "source:synthetic:text",
      "publisher": "Synthetic fixture author",
      "title": "SYNTHETIC program text",
      "url": "https://example.invalid/synthetic/demo-a",
      "retrievedAt": "2099-01-01T00:00:00Z",
      "publishedAt": null,
      "mediaType": "text/plain",
      "snapshotHash": "sha256:61d91a4351878dc737f0fbc6f2d1d6e491d1bcb929d424461ed319eec44ced41",
      "rights": "redistributable",
      "supersededBy": null
    }
  ],
  "snapshots": [
    {
      "hash": "sha256:61d91a4351878dc737f0fbc6f2d1d6e491d1bcb929d424461ed319eec44ced41",
      "content": "SYNTHETIC FIXTURE. This is not a real ballot measure.\nSection 1. The fictional demonstration program lasts one year.\n"
    }
  ],
  "findings": [
    {
      "id": "finding_revision:synthetic:duration-v1",
      "claimId": "claim:synthetic:duration-v1",
      "measureId": "measure:synthetic:demo-a",
      "assertion": "The fictional program has a one-year duration.",
      "scope": {
        "jurisdictionId": "jurisdiction:synthetic:demo",
        "electionId": "election:synthetic:2099-11-03"
      },
      "type": "official_text",
      "evidence": [
        {
          "sourceRevisionId": "source_revision:synthetic:text-v1",
          "excerpt": "The fictional demonstration program lasts one year.",
          "start": 65,
          "end": 116,
          "section": "Section 1",
          "page": null
        }
      ],
      "counterevidence": [],
      "uncertainty": "Synthetic fixture only; no real-world assertion.",
      "state": "approved",
      "stale": false,
      "reviewer": "Synthetic human reviewer",
      "reviewedAt": "2099-01-01T00:00:00Z",
      "supersedes": null
    },
    {
      "id": "finding_revision:synthetic:draft-v1",
      "claimId": "claim:synthetic:draft-v1",
      "measureId": "measure:synthetic:demo-a",
      "assertion": "The fictional program has a one-year duration.",
      "scope": {
        "jurisdictionId": "jurisdiction:synthetic:demo",
        "electionId": "election:synthetic:2099-11-03"
      },
      "type": "official_text",
      "evidence": [
        {
          "sourceRevisionId": "source_revision:synthetic:text-v1",
          "excerpt": "The fictional demonstration program lasts one year.",
          "start": 65,
          "end": 116,
          "section": "Section 1",
          "page": null
        }
      ],
      "counterevidence": [],
      "uncertainty": "Synthetic fixture only; no real-world assertion.",
      "state": "draft",
      "stale": false,
      "reviewer": null,
      "reviewedAt": null,
      "supersedes": null
    }
  ],
  "reviewEvents": [
    {
      "id": "event:synthetic:duration-review",
      "findingRevisionId": "finding_revision:synthetic:duration-v1",
      "actor": "Synthetic human reviewer",
      "actorType": "human",
      "from": "draft",
      "to": "in_review",
      "at": "2099-01-01T00:00:00Z",
      "reason": "Simulated review for tests only."
    },
    {
      "id": "event:synthetic:duration-approve",
      "findingRevisionId": "finding_revision:synthetic:duration-v1",
      "actor": "Synthetic human reviewer",
      "actorType": "human",
      "from": "in_review",
      "to": "approved",
      "at": "2099-01-01T00:00:00Z",
      "reason": "Simulated approval for tests only; not an editorial decision."
    }
  ]
}
